Section,Question,English,Sección,Pregunta,Spanish
Influencing Style,68,"Sometimes, in my enthusiasm, I push my views too far with people",Estilo de Influencia,68,"A veces, en mi entusiasmo, llevo mis puntos de vista demasiado lejos con la gente."
Influencing Style,69,My inspired thoughts surprise me with their clarity and unexpected direction,Estilo de Influencia,69,Mis pensamientos inspirados me sorprenden con su claridad y dirección inesperada
Influencing Style,70,"I have a clear vision, and others have said that they feel confident to go along with me",Estilo de Influencia,70,"Tengo una visión clara, y otros han dicho que se sienten seguros de seguirme."
Influencing Style,71,I sometimes have difficulty setting boundaries with needy people,Estilo de Influencia,71,A veces tengo dificultad para establecer límites con las personas necesitadas
Influencing Style,72,I try to think of different ways of expressing the truth,Estilo de Influencia,72,Trato de pensar en diferentes formas de expresar la verdad.
Influencing Style,73,I am interested in living and working overseas or among people from a different culture,Estilo de Influencia,73,Estoy interesado en vivir y trabajar en el extranjero o entre personas de una cultura diferente
Influencing Style,74,I regularly like to be alone for long periods of time to reflect and think,Estilo de Influencia,74,Regularmente me gusta estar solo durante largos períodos de tiempo para reflexionar y pensar.
Influencing Style,75,I get frustrated when I feel I’m not experiencing new things in my life,Estilo de Influencia,75,Me frustro cuando siento que no estoy experimentando cosas nuevas en mi vida
Influencing Style,76,I empathize with those who are hurting and can support them through their pain to wholeness,Estilo de Influencia,76,Empatizo con aquellos que están sufriendo y puedo apoyarlos a través de su dolor hasta que alcancen la plenitud.
Influencing Style,77,People have told me I have communicated timely words which felt directly from God,Estilo de Influencia,77,La gente me ha dicho que he comunicado palabras oportunas que sintieron fueron directamente de parte de Dios.
Influencing Style,78,I love to meet new people and get to know their story,Estilo de Influencia,78,Me encanta conocer gente nueva y conocer su historia.
Influencing Style,79,Sometimes I am reveal specific things that later happened or meant something at a later date,Estilo de Influencia,79,A veces revelo cosas específicas que sucedieron más tarde o significaron algo en una fecha posterior
Influencing Style,80,"When reading, it is easier for me to grasp the wider picture or message than the specific details",Estilo de Influencia,80,"Al leer, me resulta más fácil captar la imagen o el mensaje más amplio que los detalles específicos."